{
  "schema_version":"1.0","lens":"validity_boundary","lens_kind":"core","source_sha256":"6eae057a9faf4f671c3101e0745ed704460c6d3dec77243dfd3a9f2d2ab68970","base_sha256":"8b5d23e2847d89205452c786f89c83776f487e0d2a8fc741db69ce28c9bd8774",
  "summary":"The evaluation is strong for its stated filtered targets and metrics, but the paper itself limits claims by dataset conditions, MSA/contact context, PDB conditioning and the distinction between confidence and functional explanation.",
  "findings":[
    {"id":"VB-1","statement":"CASP14 and recent-PDB results support high accuracy on selected protein domains/chains, not all proteins or all biological states.","evidence":["F01","F02","p.2","p.3"],"epistemic":"SUPPORTED","action":"QUALIFY","importance":"CRITICAL","reason":"Selection and filtering are part of the reported protocol.","cross_cutting_checks":{"anomaly":null,"counterfactual":"A result can be valid on the filtered set while failing under alternate conformations, ligands, ions, or complexes."}},
    {"id":"VB-2","statement":"Ablations identify performance dependence but do not establish a complete unique causal explanation of the learned network.","evidence":["F04","p.5"],"epistemic":"SUPPORTED","action":"QUALIFY","importance":"MAJOR","reason":"Component removal can expose necessity in context while leaving interactions and correlated mechanisms unresolved.","cross_cutting_checks":{"anomaly":null,"counterfactual":"Different components could compensate if retrained under a different protocol; the reported ablations do not test every retraining alternative."}},
    {"id":"VB-3","statement":"The paper reports peptide-bond geometry is not hard-constrained during structure generation and relies on post-prediction relaxation for stereochemical violations.","evidence":["F03","p.4"],"epistemic":"VERIFIED","action":"EXPAND","importance":"MAJOR","reason":"This is a concrete method boundary often lost in a generic accuracy summary.","cross_cutting_checks":{"anomaly":null,"counterfactual":null}},
    {"id":"VB-4","statement":"pLDDT is a confidence signal correlated with local accuracy, not a proof of function, mechanism, or complete complex-state correctness.","evidence":["F02","p.3","p.6"],"epistemic":"SUPPORTED","action":"QUALIFY","importance":"CRITICAL","reason":"The inference ceiling must remain explicit.","cross_cutting_checks":{"anomaly":null,"counterfactual":"A high-confidence local fold can coexist with an incorrect ligand state or inter-chain arrangement."}}
  ]
}
