{
  "schema_version":"1.0","lens":"argument_narrative","lens_kind":"core","source_sha256":"6eae057a9faf4f671c3101e0745ed704460c6d3dec77243dfd3a9f2d2ab68970","base_sha256":"8b5d23e2847d89205452c786f89c83776f487e0d2a8fc741db69ce28c9bd8774",
  "summary":"The article builds a layered empirical case rather than a generic pipeline: benchmark success is established first, architecture is then opened, internal operations are probed with ablations and trajectories, and scope is narrowed by data/contact conditions.",
  "findings":[
    {"id":"AN-1","statement":"The paper's native arc is benchmark claim -> architecture -> interpretive tests -> applicability boundaries -> discussion, not a simple method/results checklist.","evidence":["p.2","p.4","p.5","p.6"],"epistemic":"VERIFIED","action":"KEEP","importance":"CRITICAL","reason":"Preserving this order explains why the ablation and limitation sections matter to the central claim.","cross_cutting_checks":{"anomaly":null,"counterfactual":"If the paper opened with architecture and omitted the benchmark setup, the reader could not interpret the later components as explanations of a demonstrated capability."}},
    {"id":"AN-2","statement":"Fig. 1 deliberately combines performance examples with a model-flow overview, making accuracy and construction a linked case.","evidence":["F01","p.2"],"epistemic":"SUPPORTED","action":"EXPAND","importance":"MAJOR","reason":"The figure's panels are argumentative, not merely illustrative.","cross_cutting_checks":{"anomaly":"The original deterministic crop captured only a Templates subpanel; full-page verification corrects this provenance error.","counterfactual":null}},
    {"id":"AN-3","statement":"The final discussion qualifies the strong prediction claim by naming PDB-conditioned context and cross-chain limitations.","evidence":["F05","p.6"],"epistemic":"SUPPORTED","action":"QUALIFY","importance":"CRITICAL","reason":"A universal claim would exceed the article's own boundary language.","cross_cutting_checks":{"anomaly":null,"counterfactual":"A model could retain high benchmark scores while failing on proteins whose structure depends primarily on heteromeric contacts."}}
  ]
}
