{
  "schema_version": "1.0",
  "lens": "argument_narrative",
  "lens_kind": "core",
  "source_sha256": "e9a0d3128767db616085dc0f4e6e455e672e89af823e8ed1282793682787395a",
  "base_sha256": "7f5377fff58ba5872ff805196eba449fa044edc91bbfec485f954b1fa212b0a9",
  "summary": "LoRA 的论证核心是把“巨型模型适配的部署成本”转写为“任务增量是否需要满秩”的问题。论文按成本动机、替代方案瓶颈、可合并低秩参数化、跨规模实证、rank/子空间解释推进；附录保留 latency、数据集与超参证据，说明主线并非固定章节模板。",
  "findings": [
    {
      "id": "AN1",
      "statement": "作者把低秩更新假设放在部署问题之后，而不是直接从数学重参数化开始。",
      "evidence": [
        "p.1",
        "p.2",
        "p.3"
      ],
      "epistemic": "SUPPORTED",
      "action": "KEEP",
      "importance": "MINOR",
      "reason": "Independent source-grounded pass; finding records what the Lead Reader should preserve or qualify.",
      "cross_cutting_checks": {
        "anomaly": null,
        "counterfactual": null
      }
    },
    {
      "id": "AN2",
      "statement": "方法主张同时包含参数效率、训练显存/吞吐、无额外推理延迟和质量保持四个彼此相关但不等价的结果。",
      "evidence": [
        "p.4",
        "T01",
        "T02",
        "T04"
      ],
      "epistemic": "SUPPORTED",
      "action": "EXPAND",
      "importance": "MAJOR",
      "reason": "Independent source-grounded pass; finding records what the Lead Reader should preserve or qualify.",
      "cross_cutting_checks": {
        "anomaly": null,
        "counterfactual": null
      }
    },
    {
      "id": "AN3",
      "statement": "主文从 RoBERTa/DeBERTa 到 GPT-2/GPT-3 再到 rank 与子空间解释，形成由可行性到机制线索的升级链。",
      "evidence": [
        "p.6",
        "p.8",
        "p.17",
        "p.26"
      ],
      "epistemic": "VERIFIED",
      "action": "KEEP",
      "importance": "MINOR",
      "reason": "Independent source-grounded pass; finding records what the Lead Reader should preserve or qualify.",
      "cross_cutting_checks": {
        "anomaly": null,
        "counterfactual": null
      }
    },
    {
      "id": "AN4",
      "statement": "结论应明确为所测模型、任务和 attention 配置下的经验支持，而非低 rank 对所有适配都充分。",
      "evidence": [
        "p.5",
        "p.26"
      ],
      "epistemic": "VERIFIED",
      "action": "QUALIFY",
      "importance": "MAJOR",
      "reason": "Independent source-grounded pass; finding records what the Lead Reader should preserve or qualify.",
      "cross_cutting_checks": {
        "anomaly": null,
        "counterfactual": null
      }
    }
  ]
}
